<?xml version="1.0" encoding="UTF-8"?>

<xs:schema xmlns:xs="http://www.w3.org/2001/XMLSchema">
        
    <xs:complexType name="oraTipus">
        <xs:sequence>
            <xs:element name="targy" type="xs:string"/>
            <xs:element name="idopont" type="idopontTipus"/>
            <xs:element name="helyszin" type="xs:string"/>
            <xs:element name="oktato" type="xs:string"/>
            <xs:element name="szak" type="xs:string"/>
        </xs:sequence>
        <xs:attribute name="id" type="xs:int" use="required"/>
        <xs:attribute name="tipus" type="xs:string" default="eloadas"/>
    </xs:complexType>
    

    <xs:complexType name="idopontTipus">
        <xs:sequence>
            <xs:element name="nap" type="napTipus"/>
            <xs:element name="tol" type="idoTipus"/>
            <xs:element name="ig" type="idoTipus"/>
        </xs:sequence>
    </xs:complexType>

    <xs:simpleType name="napTipus">
        <xs:restriction base="xs:string">
            <xs:enumeration value="Hetfo"/>
            <xs:enumeration value="Kedd"/>
            <xs:enumeration value="Szerda"/>
        </xs:restriction>
    </xs:simpleType>

    <xs:simpleType name="idoTipus">
        <xs:restriction base="xs:int">
            <xs:minInclusive value="0"/>
            <xs:maxInclusive value="20"/>
        </xs:restriction>
    </xs:simpleType>

    <xs:element name="oy6icj_orarend">
        <xs:complexType>
            <xs:sequence>
                <xs:element name="ora" type="oraTipus" minOccurs="0" maxOccurs="unbounded"/>
            </xs:sequence>
        </xs:complexType>
    </xs:element>
</xs:schema>